{
  "run_id": "20260814-strideform-l3",
  "methodology": "angle-ideation-agent@1.6.0",
  "critic": "angle-gate-critic@1.6.0",
  "pack_mean": 4.42,
  "pack_pass": true,
  "dimension_mins": {
    "hollow_specificity": 4.25,
    "villain_concreteness": 4.5,
    "dream_render": 4.25,
    "belief_move": 4.5,
    "headline_punch": 4.5,
    "mechanism_honesty": 4.5
  },
  "angles": [
    {
      "ordinal": 1,
      "hollow_specificity": 5,
      "villain_concreteness": 5,
      "dream_render": 5,
      "belief_move": 5,
      "headline_punch": 5,
      "mechanism_honesty": 5,
      "mean": 5.0,
      "evidence": "drawer is full of dead cushions; gel/foam pads that collapse; firm arch answer"
    },
    {
      "ordinal": 2,
      "hollow_specificity": 4,
      "villain_concreteness": 4,
      "dream_render": 4,
      "belief_move": 5,
      "headline_punch": 5,
      "mechanism_honesty": 4,
      "mean": 4.33,
      "evidence": "training calendar becomes a museum; wait-and-stretch-only advice"
    },
    {
      "ordinal": 3,
      "hollow_specificity": 4,
      "villain_concreteness": 5,
      "dream_render": 4,
      "belief_move": 5,
      "headline_punch": 5,
      "mechanism_honesty": 5,
      "mean": 4.67,
      "evidence": "gel pad went flat; betrayal with a pharmacy receipt"
    },
    {
      "ordinal": 4,
      "hollow_specificity": 5,
      "villain_concreteness": 4,
      "dream_render": 5,
      "belief_move": 5,
      "headline_punch": 5,
      "mechanism_honesty": 4,
      "mean": 4.67,
      "evidence": "bench parent on purpose; mid-chase without narrating the limp"
    },
    {
      "ordinal": 5,
      "hollow_specificity": 4,
      "villain_concreteness": 4,
      "dream_render": 4,
      "belief_move": 4,
      "headline_punch": 4,
      "mechanism_honesty": 4,
      "mean": 4.0,
      "evidence": "I snapped when they asked me to play; first-step stab ritual"
    },
    {
      "ordinal": 6,
      "hollow_specificity": 4,
      "villain_concreteness": 5,
      "dream_render": 4,
      "belief_move": 4,
      "headline_punch": 4,
      "mechanism_honesty": 5,
      "mean": 4.33,
      "evidence": "Everyone had a stretch; nobody fixed my landing"
    },
    {
      "ordinal": 7,
      "hollow_specificity": 4,
      "villain_concreteness": 4,
      "dream_render": 4,
      "belief_move": 4,
      "headline_punch": 4,
      "mechanism_honesty": 4,
      "mean": 4.0,
      "evidence": "timed hallway walks; flat fashion sneakers"
    },
    {
      "ordinal": 8,
      "hollow_specificity": 4,
      "villain_concreteness": 4,
      "dream_render": 4,
      "belief_move": 4,
      "headline_punch": 4,
      "mechanism_honesty": 5,
      "mean": 4.17,
      "evidence": "unequal walking partners; same sidewalk shared pace"
    }
  ]
}
