{
  "run_id": "20260814-negcontrol-feature",
  "methodology": "angle-ideation-agent@1.6.0",
  "critic": "angle-gate-critic@1.6.0",
  "pack_mean": 1.4,
  "pack_pass": false,
  "dimension_mins": {
    "hollow_specificity": 1.0,
    "villain_concreteness": 1.0,
    "dream_render": 1.2,
    "belief_move": 1.0,
    "headline_punch": 1.3,
    "mechanism_honesty": 1.5
  },
  "angles": [
    {
      "ordinal": 1,
      "hollow_specificity": 1,
      "villain_concreteness": 1,
      "dream_render": 1,
      "belief_move": 1,
      "headline_punch": 1,
      "mechanism_honesty": 2,
      "mean": 1.17,
      "evidence": "She felt stressed and overwhelmed every night."
    },
    {
      "ordinal": 2,
      "hollow_specificity": 1,
      "villain_concreteness": 1,
      "dream_render": 1,
      "belief_move": 1,
      "headline_punch": 2,
      "mechanism_honesty": 1,
      "mean": 1.17,
      "evidence": "A must-have transparent collection cup."
    },
    {
      "ordinal": 3,
      "hollow_specificity": 1,
      "villain_concreteness": 1,
      "dream_render": 1,
      "belief_move": 1,
      "headline_punch": 1,
      "mechanism_honesty": 1,
      "mean": 1.0,
      "evidence": "20% off the aspirator moms swear by."
    },
    {
      "ordinal": 4,
      "hollow_specificity": 1,
      "villain_concreteness": 1,
      "dream_render": 1,
      "belief_move": 1,
      "headline_punch": 1,
      "mechanism_honesty": 2,
      "mean": 1.17,
      "evidence": "I opened the Baby Bubble box and cried happy tears."
    },
    {
      "ordinal": 5,
      "hollow_specificity": 1,
      "villain_concreteness": 1,
      "dream_render": 1,
      "belief_move": 1,
      "headline_punch": 1,
      "mechanism_honesty": 1,
      "mean": 1.0,
      "evidence": "Hospital-grade suction clears mucus in seconds."
    },
    {
      "ordinal": 6,
      "hollow_specificity": 1,
      "villain_concreteness": 1,
      "dream_render": 2,
      "belief_move": 1,
      "headline_punch": 2,
      "mechanism_honesty": 2,
      "mean": 1.5,
      "evidence": "Transparent collection cup. Quiet motor. Easy rinse."
    }
  ]
}
